{
  "schema_version": "0.1.0",
  "evidence_id": "ev-0003",
  "issued_at": "2026-06-21T00:00:00Z",
  "source": "synthetic-test",
  "artifact_hash": "not-a-valid-sha256-prefixed-hash",
  "previous_hash": "sha256:0000000000000000000000000000000000000000000000000000000000000000",
  "policy_id": "policy.bootstrap",
  "decision": "review",
  "signature": {
    "alg": "ES256",
    "key_id": "test-key",
    "value": "synthetic-signature-placeholder"
  }
}
